query,answer,top_chunk,top_score,similarity_score,f1_score,found_in_top_k,found_in_top_1,found_in_top_3,found_in_top_5
What has COVID-19 taught us about the management of antimicrobial resistance?,"COVID-19 has illustrated the vulnerability of our healthcare systems in co-managing multiple infectious disease threats as resources for monitoring and detecting, and conducting research on antimicrobial resistance have been compromised during the pandemic.","."" Key considerations on the potential impacts of the COVID-19 pandemic on antimicrobial resistance research and surveillance https://doi.org/10.1093/trstmh/trab048 ""Antibiotic use in severe acute respiratory syndrome coronavirus 2 (SARS-CoV-2) patients during the COVID-19 pandemic has exceeded the incidence of bacterial coinfections and secondary infections, suggesting inappropriate and excessive prescribing. Even in settings with established antimicrobial stewardship (AMS) programmes, there were weaknesses exposed regarding appropriate antibiotic use in the context of the pandemic.",0.6663744449615479,0.5380249716231555,0.6595744680851063,True,False,True,True
What is the focus of proposed host-directed therapies for AMR?,"The paper presents the considerable successes that have been achieved over a short period of time in a livestock sector, while generating notes of caution concerning the audit-led management of livestock-related AMR threats.",iance on antimicrobial therapy. We highlight pre-clinical and clinical data pointing towards potential targets and therapies. We suggest that developing focused host-directed therapeutic strategies to enhance 'pauci- inflammatory' microbial killing in myeloid phagocytes that maximizes pathogen clearance while minimizing the harmful consequences of the inflammatory response merits particular attention. We also suggest the importance of One Health approaches in developing host-based approaches though model development and comparative medicine in informing our understanding of how to deliver this strategy.while,0.6608794331550598,0.04597701149425287,0.16216216216216214,False,False,False,False
How common are drug-resistant E. coli in urinary tract infections in rural India?,Results A total of 301 (59.7%) samples showed significant bacteriuria along with symptoms of UTI and among them 103 isolates were identified as E. coli of multiple STs..,"e ESBL genes—blaCTX-M-15, blaSHV-148, blaPER-1 and blaTEM— and two E. coli isolates carrying the blaNDM-1 carbapenemase gene. ESBL genes were located within transconjugable plasmids of IncP and IncF type whereas blaNDM-1 was carried in an IncFrepB type plasmid. Conclusions This study illustrates the high rate of MDR in E. coli causing UTI in primary care in rural Assam. UTIs caused by ESBL- or MBL- producing bacteria are very difficult to treat and can often lead to treatment failure.",0.6234720945358276,0.42547770700636944,0.5263157894736843,True,False,False,False
What genetic element is responsible for multidrug resistance in the 2287 clone of R. equi?,"Most MDR isolates carried the rpoBS531F mutation of the 2287 clone, while different rpoB mutations (S531L, S531Y) detected in two cases suggest the emergence of novel MDR R. equi strains.","equi https://doi.org/10.1128/jcm.01149-21 ""Clonal multidrug resistance recently emerged in Rhodococcus equi, complicating the therapeutic management of this difficult-to-treat animal- and human- pathogenic actinomycete. The currently spreading multidrug-resistant (MDR) """"2287"""" clone arose in equine farms upon acquisition, and coselection by mass macrolide- rifampin therapy, of the pRErm46 plasmid carrying the erm(46) macrolide-lincosamide- streptogramin resistance determinant, and of an rpoBS531F mutation. Here, we screened a collection of susceptible and macrolide-resistant R.",0.6906856298446655,0.43467336683417085,0.5161290322580645,True,False,True,True
What kind of regulation is recommended to improve antibiotic use in poorer countries?,"However, there is limited evidence on the effectiveness of these national efforts in LMICs.","e countries (LMICs) have implemented new policies to optimize antibiotic use in both formal and informal healthcare settings. However, there is limited evidence on the effectiveness of these national efforts.Methods: We investigated the empirical relationship between national policies aimed at restricting antibiotic use and actual antibiotic consumption in 138 LMICs. Data on national policies were obtained from the Tripartite AMR Country Self-Assessment Survey (TrACSS) as well as from the Global Survey of Experts on AMR (GSEAR). Seven independent variables pertaining to AMR policies were evaluated.",0.6685727834701538,0.2812006319115324,0.37837837837837834,True,True,True,True
What is a major human factor influencing antibiotic use in animal farming?,The study fills a conspicuous gap in the existing AMR and One Health literatures examining links between farm management practices and AMU and AMR in European livestock production.,"sistant bacterial infections in humans and reduce the impact of interventions that curtail antibiotic consumption in animals. More data on the types and dynamics of resistance in the environment and frequency of human-environment transmission is crucial to understanding the population dynamics of antibiotic resistance."" Global trends in antimicrobial resistance on organic and conventional farms ""ABSTRACT Various https://doi.org/10.1101/2023.04.07.536071 stewardship policies, regulations, and voluntary bans have focused on protecting antimicrobials by limiting their use in livestock.",0.6617044806480408,0.04477611940298507,0.23076923076923078,False,False,False,False
What factors were found to be stronger predictors of antimicrobial resistance gene abundance than antibiotic use?,"However, AMR gene abundance strongly correlates with socio-economic, health and environmental factors, which we use to predict AMR gene abundances in all countries in the world.","matic differences in abundance and diversity of AMR genes between Europe/North-America/Oceania and Africa/Asia/South-America. Antimicrobial use data and bacterial taxonomy only explains a minor part of the AMR variation that we observe. We find no evidence for cross-selection between antimicrobial classes, or for effect of air travel between sites. However, AMR gene abundance strongly correlates with socio-economic, health and environmental factors, which we use to predict AMR gene abundances in all countries in the world.",0.6396090388298035,0.48226950354609927,0.5974025974025974,True,True,True,True
Why is antibiotic resistance in animals an ethical and ecological issue?,"Despite a large and rapidly growing volume of research activity and output, primarily on the biological bases of antimicrobial resistance (AMR), epidemiological understanding of the causal mechanisms at play behind the apparent recent global rise in prevalence of AMR has, arguably, progressed very little.","ans, livestock and the wider environment"" https://doi.org/10.1098/rstb.2014.0083 ""Antimicrobial resistance (AMR) in humans is inter-linked with AMR in other populations, especially farm animals, and in the wider environment. The relatively few bacterial species that cause disease in humans, and are the targets of antibiotic treatment, constitute a tiny subset of the overall diversity of bacteria that includes the gut microbiota and vast numbers in the soil. However, resistance can pass between these different populations; and homologous resistance genes have been found in pathogens, normal flora and soil bacteria.",0.630183219909668,0.1121898597626753,0.39560439560439553,False,False,False,False
What is the advantage of using Hi-C metagenomics in AMR surveillance?,Here we present a laboratory and bioinformatics pipeline HAM-ART (Hi-C Assisted Metagenomics for Antimicrobial Resistance Tracking) optimised forWe propose metagenomic analysis of sewage as an ethically acceptable and economically feasible approach for continuous global surveillance and prediction of AMR.,"ial usage in animals, and in surveillance of AMR, which are likely to be starkest between developed and developing countries. Thus, it is unlikely that the impacts of AMR, and the impacts of efforts to mitigate AMR that are directed to the ‘animal compartment’ of the ecosystem, will be felt equally across the world."" HAM-ART: An optimised culture-free Hi-C metagenomics pipeline for tracking antimicrobial resistance genes in complex microbial communities https://doi.org/10.1371/journal.pgen.1009776 ""Shotgun metagenomics is a powerful tool to identify antimicrobial resistance (AMR) genes in microbiomes but has the",0.6760095357894897,0.31265508684863524,0.43298969072164945,True,False,True,True
How can studying sewage help track antibiotic resistance around the world?,We propose metagenomic analysis of sewage as an ethically acceptable and economically feasible approach for continuous global surveillance and prediction of AMR.,"""Antimicrobial Global monitoring of antimicrobial resistance based on metagenomics analyses of urban sewage https://doi.org/10.1038/s41467-019-08853-3 resistance (AMR) is a serious threat to global public health, but obtaining representative data on AMR for healthy human populations is difficult. Here, we use metagenomic analysis of untreated sewage to characterize the bacterial resistome from 79 sites in 60 countries. We find systematic differences in abundance and diversity of AMR genes between Europe/North-America/Oceania and Africa/Asia/South-America.",0.7251157164573669,0.23333333333333334,0.4878048780487805,True,False,False,False
How is Uganda trying to monitor antibiotic resistance?,This article examines efforts and progress in developing and implementing a human health antimicrobial resistance surveillance strategy in Uganda., efforts and progress in developing and implementing a human health antimicrobial resistance surveillance strategy in Uganda. We do so within the context of the National Action Plan for tackling antimicrobial resistance (AMR-NAP) launched in 2018. We discuss the technical milestones and progress in implementing surveillance of GLASS priority pathogens under this framework. The preliminary output of the framework examines the performance and compares AMR and AMU surveillance data to explain observed trends.,0.6922035217285156,0.4332344213649852,0.47058823529411764,True,True,True,True
What is a major problem with antibiotic use in Pakistan's primary care?,"Antibiotics are gradually becoming less effective against bacteria worldwide, and this issue is of particular concern in economically-developing nations like Pakistan.","kling antimicrobial resistance in primary care facilities across Pakistan: Current challenges and implications for the future https://doi.org/10.1016/j.jiph.2023.10.046 ""Antibiotics are gradually becoming less effective against bacteria worldwide, and this issue is of particular concern in economically-developing nations like Pakistan. We undertook a scoping review in order to review the literature on antimicrobial use, prescribing, dispensing and the challenges associated with antimicrobial resistance in primary care (PC) settings in Pakistan.",0.7143670320510864,0.46582984658298465,0.547945205479452,True,True,True,True
How do UK farm vets view diagnostic tests in managing antibiotic use?,The findings identify a considerable ambivalence on the part of farm animal veterinarians regarding the current and future uses of rapid and point-of-care diagnostic tests as a means of improving clinical diagnosis and addressing inappropriate antibiotic medicine use.,", while food chain actors and others are increasingly seeking to make diagnostic tests mandatory before the use of critically important antibiotics. Method This paper reports the findings of a recent large-scale online survey of UK farm animal veterinarians (n=153) which investigated current veterinary diagnostic practice with particular attention to the relationship between diagnostic test use and antibiotic treatment. Results Results revealed a range of factors that influence veterinary diagnostic practice and demonstrate the continuing importance of clinical observation and animal/herd knowledge in the selection",0.7834392786026001,0.6042841037204059,0.6741573033707866,True,False,False,True
How might epigenetic changes contribute to antimicrobial resistance?,"Since the discovery of antibiotics, humans have been benefiting from them by decreasing the morbidity and mortality associated with bacterial infections.","igenetic modifications in the bacterial genome and host epigenetic reprogramming due to interaction with resistant pathogens. Epigenetic changes, such as the DNA-methylation-based regulation of bacterial mutation rates or bacteria-induced histone modification in human epithelial cells, facilitate its long-term survival. In this review article, epigenetic changes leading to the development of antibiotic resistance in clinically relevant bacteria are discussed. Additionally, recent lines of evidence focusing on human host epigenetic changes due to the human-pathogen interactions are presented.",0.7466340065002441,0.4396551724137931,0.4749999999999999,True,False,True,True
What is the title of the study concerning masuring AMR in untreated sewage?,Global monitoring of antimicrobial resistance based on metagenomics analyses of urban sewagehttps://doi.org/10.1038/s41467-019-08853-3,"""Antimicrobial Global monitoring of antimicrobial resistance based on metagenomics analyses of urban sewage https://doi.org/10.1038/s41467-019-08853-3 resistance (AMR) is a serious threat to global public health, but obtaining representative data on AMR for healthy human populations is difficult. Here, we use metagenomic analysis of untreated sewage to characterize the bacterial resistome from 79 sites in 60 countries. We find systematic differences in abundance and diversity of AMR genes between Europe/North-America/Oceania and Africa/Asia/South-America.",0.6097639799118042,0.3856115107913669,0.2941176470588235,True,True,True,True
