query,answer,top_chunk,top_score,similarity_score,f1_score,found_in_top_k,found_in_top_1,found_in_top_3,found_in_top_5
How can studying sewage help track antibiotic resistance around the world?,We propose metagenomic analysis of sewage as an ethically acceptable and economically feasible approach for continuous global surveillance and prediction of AMR,"""Antimicrobial Global monitoring of antimicrobial resistance based on metagenomics analyses of urban sewage https://doi.org/10.1038/s41467-019-08853-3 resistance (AMR) is a serious threat to global public health, but obtaining representative data on AMR for healthy human populations is difficult. Here, we use metagenomic analysis of untreated sewage to characterize the bacterial resistome from 79 sites in 60 countries. We find systematic differences in abundance and diversity of AMR genes between Europe/North-America/Oceania and Africa/Asia/South-America.",0.7251157164573669,0.23106546854942234,0.4878048780487805,True,False,False,False
What evidence supports the two-way traffic of AMR between farms and clinics?,Whole genome sequencing is revealing and beginning to quantify the two-way traffic of AMR bacteria between the farm and the clinic,"w https://doi.org/10.1089/fpd.2017.2411 ""The role of farm animals in the emergence and dissemination of both AMR bacteria and their resistance determinants to humans is poorly understood and controversial. Here, we systematically reviewed the current evidence that food animals are responsible for transfer of AMR to humans. We searched PubMed, Web of Science, and EMBASE for literature published between 1940 and 2016. Our results show that eight studies (18%) suggested evidence of transmission of AMR from food animals to humans, 25 studies (56%) suggested transmission between animals and humans with no direction",0.6000787019729614,0.4421768707482993,0.45945945945945943,True,True,True,True
Can common flies really spread antibiotic-resistant bacteria?,"'Filth flies' feed and develop in excrement and decaying matter and can transmit enteric pathogens to humans and animals, leading to colonization and infection. Considering these characteristics, 'filth flies' are potential vectors for the spread of antimicrobial resistance (AMR).",". This includes extended spectrum beta-lactamase-, carbapenemase- producing and colistin-resistant (mcr-1 positive) bacteria. Resistant bacteria in flies often share the same genotypes with bacteria from humans and animals when their habitat overlap. The risk of transmission is most likely highest for enteric bacteria as they are shed in high concentration in excrements and are easily picked up by flies. ‘Filth flies’ can ‘bio-enhance’ the transmission of AMR as bacteria multiply in the digestive tract, mouthparts and regurgitation spots.",0.7622861266136169,0.561849710982659,0.75,True,False,True,True
How can studying sewage help track antibiotic resistance around the world?,We propose metagenomic analysis of sewage as an ethically acceptable and economically feasible approach for continuous global surveillance and prediction of AMR,"""Antimicrobial Global monitoring of antimicrobial resistance based on metagenomics analyses of urban sewage https://doi.org/10.1038/s41467-019-08853-3 resistance (AMR) is a serious threat to global public health, but obtaining representative data on AMR for healthy human populations is difficult. Here, we use metagenomic analysis of untreated sewage to characterize the bacterial resistome from 79 sites in 60 countries. We find systematic differences in abundance and diversity of AMR genes between Europe/North-America/Oceania and Africa/Asia/South-America.",0.7250748872756958,0.23106546854942234,0.4878048780487805,True,False,False,False
How does a high-concentrate diet affect antimicrobial resistance genes in cattle?,Both the diversity and abundance of these genes were higher in concentrate-fed animals.,"istance and pathogenicity genes is directly affected by diet in beef cattle 0378-z ""The emergence and spread of antimicrobial resistance is the most urgent current threat to human and animal health. An improved understanding of the abundance of antimicrobial resistance genes and genes associated with microbial colonisation and pathogenicity in the animal gut will have a major role in reducing the contribution of animal production to this problem.",0.7083868980407715,0.2740157480314961,0.4,True,False,True,True
Why is 3D bioprinting of bacterial biofilms significant for studying AMR?,The potential to bioprint and study 3D bacterial biofilm constructs could have great clinical significance at a time when antimicrobial resistance is rising to dangerously high levels worldwide.,"d should receive additional attention."" 3D bioprinting of mature bacterial biofilms for antimicrobial resistance drug testing https://doi.org/10.1088/1758-5090/ab37a0 ""The potential to bioprint and study 3D bacterial biofilm constructs could have great clinical significance at a time when antimicrobial resistance is rising to dangerously high levels worldwide. In this study, clinically relevant bacterial species including Escherichia coli, Staphylococcus aureus (MSSA), Methicillin-resistant Staphylococcus aureus (MRSA) and Pseudomonas aeruginosa were 3D bioprinted using a double-crosslinked alginate bioink to form",0.7650392055511475,0.47607361963190187,0.5777777777777777,True,True,True,True
Are wild animals in cities spreading drug-resistant bacteria?,"Urban wildlife carry a high burden of clinically relevant antimicrobial-resistant E. coli in Nairobi, exhibiting resistance to drugs considered crucial for human medicine by WHO.",", cattle, and bovine manure.InterpretationUrban wildlife carry a high burden of clinically relevant antimicrobial-resistant E coli in Nairobi, exhibiting resistance to drugs considered crucial for human medicine by WHO. Identifiable traits of the wildlife contribute to this exposure; however, compared with humans, livestock, and the environment, low phenotypic diversity in wildlife is consistent with the hypothesis that wildlife are a net sink rather than source of clinically relevant resistance.",0.6331483125686646,0.2621502209131075,0.575,True,True,True,True
What approach is needed to understand AMR transmission between humans and livestock?,A better understanding of the human-livestock interface will aid in the development of evidence-based and effective One Health interventions that can ultimately reduce the burden of AMR in humans.,"ating various aspects of AMR transmission at the human-livestock interface are discussed, with a focus on Escherichia coli.We recapitulate the current understanding of the transmission of AMR between humans and livestock based on current genomic and epidemiological approaches. We discuss how the use of well-designed, high-resolution genome sequencing studies can improve our understanding of the human-livestock interface.A better understanding of the human-livestock interface will aid in the development of evidence-based and effective One Health interventions that can ultimately reduce the burden of AMR in humans.""",0.7977493405342102,0.47980416156670747,0.5679012345679012,True,True,True,True
What did the genomic analysis of global sewage samples reveal about resistance gene mobility?,"The genetic environments of 49 common ARGs are highly diverse, with most common ARGs carried by multiple distinct genomic contexts globally and sometimes on plasmids.","""Antimicrobial Global monitoring of antimicrobial resistance based on metagenomics analyses of urban sewage https://doi.org/10.1038/s41467-019-08853-3 resistance (AMR) is a serious threat to global public health, but obtaining representative data on AMR for healthy human populations is difficult. Here, we use metagenomic analysis of untreated sewage to characterize the bacterial resistome from 79 sites in 60 countries. We find systematic differences in abundance and diversity of AMR genes between Europe/North-America/Oceania and Africa/Asia/South-America.",0.670881986618042,0.4240102171136654,0.4893617021276596,True,False,False,True
Did COVID-19 affect how we monitor and research antibiotic resistance?,"Moreover, antimicrobial resistance (AMR) surveillance and AMS have been deprioritised with diversion of health system resources to the pandemic response.","."" Key considerations on the potential impacts of the COVID-19 pandemic on antimicrobial resistance research and surveillance https://doi.org/10.1093/trstmh/trab048 ""Antibiotic use in severe acute respiratory syndrome coronavirus 2 (SARS-CoV-2) patients during the COVID-19 pandemic has exceeded the incidence of bacterial coinfections and secondary infections, suggesting inappropriate and excessive prescribing. Even in settings with established antimicrobial stewardship (AMS) programmes, there were weaknesses exposed regarding appropriate antibiotic use in the context of the pandemic.",0.6846995949745178,0.07741935483870968,0.23809523809523808,True,False,False,False
How does biofilm thickness influence antibiotic resistance in E. coli biofilms?,Thicker 3D E. coli biofilms had greater resistance to tetracycline than thinner constructs over 7 d of treatment.,") cultures. Thicker 3D E. coli biofilms had greater resistance to tetracycline than thinner constructs over 7 d of treatment. Our methodology allowed for the precise 3D bioprinting of self-supporting 3D bacterial biofilm structures that developed biofilms during extended culture. 3D biofilm constructs containing bacterial biofilms produce a model with much greater clinical relevance compared to 2D culture models and we have demonstrated their use in antimicrobial testing."" Key considerations on the potential impacts of the COVID-19 pandemic on antimicrobial resistance research and surveillance",0.7060576677322388,0.3252279635258359,0.4444444444444445,True,True,True,True
What advantage does long-read sequencing provide in AMR studies of complex microbial communities?,"The long-read assembly also identifies 94 antimicrobial resistance genes, compared to only seven alleles in the short-read assembly","mmunities by metagenomic approaches has been enhanced by recent improvements in short-read sequencing efficiency and assembly algorithms. We describe the results of adding long-read sequencing to the mix of technologies used to assemble a highly complex cattle rumen microbial community, and compare the assembly to current short read-based methods applied to the same sample. Contigs in the long-read assembly were 7-fold longer on average, and contained 7-fold more complete open reading frames (ORF), than the short read assembly, despite having three-fold lower sequence depth.",0.6842526197433472,0.34701986754966885,0.4050632911392405,True,False,True,True
How common was antibiotic resistance in healthy people in South Africa in the 1990s?,"The overall carriage rate of resistance varied from 88.6% for ampicillin, 74.2% for trimethoprim, 52.6% for chloramphenicol, 10.2% for nalidixic acid to 7.5% for gentamicin","tps://doi.org/10.1017/s0950268800056922 ""Summary Between January and March 1992, 361 faecal specimens were collected from the healthy black population in the Transvaal Province of South Africa. Each specimen was examined for the prevalence of antimicrobial resistance in commensal bacteria. Volunteers, from both rural and urban dwellings, were divided into four age groups. The overall carriage rate of resistance varied from 88.6% for ampicillin, 74.2% for trimethoprim, 52.6% for chloramphenicol, 10.2% for nalidixic acid to 7.5% for gentamicin.",0.7633515000343323,0.3388888888888889,0.5,True,True,True,True
What was the main concern regarding antimicrobial resistance in healthy dogs in this study?,"However a high prevalence of MR- and MDR-CONS were found in these dogs, even though they had no prior antimicrobial treatment or admission to veterinary premises. These findings are of concern due to the potential for opportunistic infections, zoonotic transmission and transmission of antimicrobial resistant determinants from these bacteria to coagulase positive staphylococci.","ored similarly, whereas monitoring and evaluation (38 [20]) efforts were lower.International efforts to control antimicrobial resistance varied considerably between countries. Monitoring and evaluation efforts need improving for continuous understanding of national and international progress. International response might not be commensurate with the scale and severity of antimicrobial resistance.None."" Antimicrobial resistance and characterisation of staphylococci isolated from healthy Labrador retrievers in the United Kingdom https://doi.org/10.1186/1746-6148-10-17 ""Coagulase-positive (CoPS) and coagulase-negative",0.5934698581695557,0.7605633802816901,0.7543859649122807,True,False,False,True
Do vaccines cover the types of pneumococcal bacteria that are resistant to antibiotics?,Both vaccines accounted for 98% of penicillin non-susceptible and 100% of erythromycin non-susceptible isolates.,"icrobial resistance patterns in order to evaluate the coverage of polysaccharide and the new pneumococcal conjugate vaccines. A total of 5659 invasive isolates were included. Of these, 5124 (90.5%) were blood isolates, 308 (5.5%) were CSF isolates, 143 (2.5%) were blood and CSF and 84 (1.5%) were other normally sterile isolates. The most prevalent 11 serotypes/groups were 14, 9, 19, 6, 23, 1, 3, 4, 7, 8 and 18, in numerical order. These accounted for 84% of total serotypes/groups. The serotypes/groups included in the 23 and 14-valent polysaccharide vaccines accounted for 96% and 88% of all isolates.",0.5830937623977661,0.3159379407616361,0.3287671232876712,True,True,True,True
What unexpected role does the AcrD efflux pump play in Salmonella beyond antibiotic resistance?,"The results of these diverse experiments provide strong evidence that the AcrD efflux pump is not simply a redundant system providing response resilience, but also has distinct physiological functions."," efflux pumps. Notably, the RND efflux pump AcrD has a unique substrate profile, distinct from other Salmonella efflux pumps. Here we show that inactivation of acrD results in a profoundly altered transcriptome and modulation of pathways integral to Salmonella biology. The most significant transcriptome changes were central metabolism related, with additional changes observed in pathogenicity, environmental sensing, and stress response pathway expression.",0.7604032754898071,0.38583638583638585,0.5714285714285715,True,False,False,True
How is hospital wastewater connected to patterns of antimicrobial resistance?,We found that the relationship between hospital wastewater ARGs and antimicrobial usage or clinical isolate resistance varies by specific antimicrobial and bacterial family studied.,": Patterns of Abundance of Antimicrobial Resistance Genes in Hospital Wastewater Vary by Specific Antimicrobial and Bacterial Family https://doi.org/10.3389/fmicb.2021.703560 ""Background: Hospital wastewater is a major source of antimicrobial resistance (AMR) outflow into the environment. This study uses metagenomics to study how hospital clinical activity impacts antimicrobial resistance genes (ARGs) abundances in hospital wastewater.",0.7796998620033264,0.5020804438280166,0.54320987654321,True,True,True,True
How are machine learning methods being used to tackle antimicrobial resistance?,This is followed by a discussion of challenges and limitations that are considered barriers to scaling up the use of machine learning to address AMR,"s (LMICs), where antibiotics use and prescription are poorly managed, is considered one of the main reasons for this problem. It is projected that the COVID-19 pandemic will accelerate the threat of AMR due to the increasing use of antibiotics across the world, and especially in countries with limited resources. In recent years, machine learning-based methods showed promising results and proved capable of providing the necessary tools to inform antimicrobial prescription and combat AMR. This timely paper provides a critical and technical review of existing machine learning-based methods for addressing AMR.",0.7045079469680786,0.35294117647058826,0.5054945054945055,True,True,True,True
What did the governance analysis reveal about antimicrobial resistance action plans worldwide?,International efforts to control antimicrobial resistance varied considerably between countries,"al response to antimicrobial resistance, 2020–21: a systematic governance analysis of 114 countries"" 3099(22)00796-4 overcome antimicrobial resistance at the national, regional, and global levels is required to evaluate current progress and direct future planning. National action plans (NAPs) are the primary mechanism for guiding national strategy and action for antimicrobial resistance governance. Although several NAPs have been developed, no comprehensive content analysis of these plans exists.",0.7725138664245605,0.2649930264993027,0.2903225806451613,True,False,True,True
What antimicrobial resistance patterns were observed in pneumococcal bacteria in Scotland between 1988 and 1999?,Both vaccines accounted for 98% of penicillin non-susceptible and 100% of erythromycin non-susceptible isolates.,"ansmission and transmission of antimicrobial resistant determinants from these bacteria to coagulase positive staphylococci."" Serotypes/groups distribution and antimicrobial resistance of invasive pneumococcal isolates: implications for vaccine strategies https://doi.org/10.1017/s0950268800004787 ""Based on the invasive pneumococcal isolates referred to reference laboratories in Scotland in 1988-99, we identified the distribution of serotypes/groups and their antimicrobial resistance patterns in order to evaluate the coverage of polysaccharide and the new pneumococcal conjugate vaccines.",0.7345467805862427,0.051001821493624776,0.15,True,False,False,False
How did E. coli resistance differ across Zambian dairy farms?,"The estimated prevalence of resistance across the different farming systems was: tetracycline (10.61; 95%CI: 7.40-13.82), ampicillin (6.02; 95%CI: 3.31-8.73), sulfamethoxazole/ trimethoprim (4.49; 95%CI: 2.42-6.56), cefpodoxime (1.91; 95%CI: 0.46-3.36), gentamicin (0.89; 95%CI: 0.06-1.84) and ciprofloxacin (0%)","study focused on the use of antibiotics on small, medium and commercial-sized dairy farms in the central region of Zambia and its relationship to antibiotic resistance in Escherichia coli . A stratified random sample of 104 farms was studied, representing approximately 20% of all dairy farms in the region. On each farm, faecal samples were collected from a random sample of animals and a standardised questionnaire on the usage of antibiotics was completed. An E. coli isolate was obtained from 98.67% (371/376) of the sampled animals and tested for resistance to six classes of antibiotics.",0.777725100517273,0.8175765645805593,0.64,True,False,False,False
What did the study of veterinarians in Assam reveal about their antibiotic prescribing habits?,and a need to disseminate clear prescribing guidelines on prudent AMU.,"actors influencing veterinarians' antibiotic prescribing behaviors and their understanding of antimicrobial resistance (AMR). The study used a telephone survey of 50 veterinarians conducted in five districts in Assam state, India. The survey sought information on the most prevalent animal diseases, veterinarians' awareness of potential preventive measures, including factors determining antimicrobial prescribing; the types of antimicrobials used for different health conditions in different species, and possible options to reduce antimicrobial use (AMU).",0.77524733543396,0.028481012658227847,0.24096385542168675,True,False,True,True
What were the key findings regarding antimicrobial resistance in primary care settings in Pakistan?,"Antibiotics are gradually becoming less effective against bacteria worldwide, and this issue is of particular concern in economically-developing nations like Pakistan.","kling antimicrobial resistance in primary care facilities across Pakistan: Current challenges and implications for the future https://doi.org/10.1016/j.jiph.2023.10.046 ""Antibiotics are gradually becoming less effective against bacteria worldwide, and this issue is of particular concern in economically-developing nations like Pakistan. We undertook a scoping review in order to review the literature on antimicrobial use, prescribing, dispensing and the challenges associated with antimicrobial resistance in primary care (PC) settings in Pakistan.",0.7974622845649719,0.46582984658298465,0.547945205479452,True,True,True,True
What role do host epigenetic changes play in antimicrobial resistance?,"Since the discovery of antibiotics, humans have been benefiting from them by decreasing the morbidity and mortality associated with bacterial infections. However, in the past few decades, misuse of antibiotics has led to the emergence of bacterial infections resistant to multiple drugs, a significant health concern.","igenetic modifications in the bacterial genome and host epigenetic reprogramming due to interaction with resistant pathogens. Epigenetic changes, such as the DNA-methylation-based regulation of bacterial mutation rates or bacteria-induced histone modification in human epithelial cells, facilitate its long-term survival. In this review article, epigenetic changes leading to the development of antibiotic resistance in clinically relevant bacteria are discussed. Additionally, recent lines of evidence focusing on human host epigenetic changes due to the human-pathogen interactions are presented.",0.756483793258667,0.7372093023255814,0.7676767676767675,True,False,True,True
How does the AcrD efflux pump affect Salmonella fitness and behavior beyond antibiotic resistance?,The acrD mutant outcompeted the wild type in fitness experiments.,"e evidence that loss of the AcrD efflux pump significantly impacts the physiology of Salmonella enterica serovar Typhimurium. Inactivation of acrD led to changes in the expression of 403 genes involved in fundamental processes, including basic metabolism, virulence, and stress responses. Pathways such as these allow Salmonella to grow, survive in the environment, and cause disease. Indeed, our data show that the acrD mutant is more fit than wild-type Salmonella under standard lab conditions.",0.7918123006820679,0.10248901903367497,0.22784810126582278,True,False,False,True
What did metagenomic analysis of sewage reveal about links between ARG abundance and socioeconomic factors?,"However, AMR gene abundance strongly correlates with socio-economic, health and environmental factors, which we use to predict AMR gene abundances in all countries in the world","n the association between the most important variables and the observed ARG abundance across the different country subgroups. We compared our predictions with available clinical phenotypic data from the SENTRY Antimicrobial Surveillance Program from eight antimicrobial classes and 12 genera from 56 countries.Using antimicrobial use data from between Jan 1, 2016, and Dec 31, 2019, we found that antimicrobial usage was not significantly associated with the global ARG abundance in sewage (p=0·72; incidence rate ratio 1·02 [95% CI 0·92-1·13]), whereas country-specific World Bank's variables explained a large amount of",0.6708950996398926,0.0425,0.19999999999999998,False,False,False,False
Which specific factors in hospitals influenced the abundance of resistance genes in wastewater?,"Overall, ARG abundance within hospital wastewater did not reflect resistance patterns in clinical isolates from concurrent hospital inpatients.",": Patterns of Abundance of Antimicrobial Resistance Genes in Hospital Wastewater Vary by Specific Antimicrobial and Bacterial Family https://doi.org/10.3389/fmicb.2021.703560 ""Background: Hospital wastewater is a major source of antimicrobial resistance (AMR) outflow into the environment. This study uses metagenomics to study how hospital clinical activity impacts antimicrobial resistance genes (ARGs) abundances in hospital wastewater.",0.7239292860031128,0.4028169014084507,0.425,True,False,False,True
How can machine learning help fight antibiotic resistance in low-income countries?,"This is followed by a discussion of challenges and limitations that are considered barriers tCOVID-19 has illustrated the vulnerability of our healthcare systems in co-managing multiple infectious disease threats as resources for monitoring and detecting, and conducting research on antimicrobial resistance have been compromised during the pandemic.o scaling up the use of machine learning to address AMR.","s (LMICs), where antibiotics use and prescription are poorly managed, is considered one of the main reasons for this problem. It is projected that the COVID-19 pandemic will accelerate the threat of AMR due to the increasing use of antibiotics across the world, and especially in countries with limited resources. In recent years, machine learning-based methods showed promising results and proved capable of providing the necessary tools to inform antimicrobial prescription and combat AMR. This timely paper provides a critical and technical review of existing machine learning-based methods for addressing AMR.",0.6857248544692993,0.16617790811339198,0.47058823529411764,True,False,True,True
