query,answer,top_chunk,top_score,similarity_score,f1_score,found_in_top_k,found_in_top_1,found_in_top_3,found_in_top_5
How can studying sewage help track antibiotic resistance around the world?,We propose metagenomic analysis of sewage as an ethically acceptable and economically feasible approach for continuous global surveillance and prediction of AMR,"""Antimicrobial Global monitoring of antimicrobial resistance based on metagenomics analyses of urban sewage https://doi.org/10.1038/s41467-019-08853-3 resistance (AMR) is a serious threat to global public health, but obtaining representative data on AMR for healthy human populations is difficult. Here, we use metagenomic analysis of untreated sewage to characterize the bacterial resistome from 79 sites in 60 countries. We find systematic differences in abundance and diversity of AMR genes between Europe/North-America/Oceania and Africa/Asia/South-America.",0.7251157164573669,0.03003003003003003,0.4878048780487805,True,False,False,True
What evidence supports the two-way traffic of AMR between farms and clinics?,Whole genome sequencing is revealing and beginning to quantify the two-way traffic of AMR bacteria between the farm and the clinic,"aling and beginning to quantify the two-way traffic of AMR bacteria between the farm and the clinic. Surveillance of bacterial disease, drug usage and resistance in livestock is still relatively poor, though improving, but achieving better antimicrobial stewardship on the farm is challenging: antibiotics are an integral part of industrial agriculture and there are very few alternatives. Human production and use of antibiotics either on the farm or in the clinic is but a recent addition to the natural and ancient process of antibiotic production and resistance evolution that occurs on a global",0.6668090224266052,0.46181172291296624,0.4788732394366197,True,True,True,True
Can common flies really spread antibiotic-resistant bacteria?,"'Filth flies' feed and develop in excrement and decaying matter and can transmit enteric pathogens to humans and animals, leading to colonization and infection. Considering these characteristics, 'filth flies' are potential vectors for the spread of antimicrobial resistance (AMR).","spectrum beta-lactamase-, carbapenemase- producing and colistin-resistant (mcr-1 positive) bacteria. Resistant bacteria in flies often share the same genotypes with bacteria from humans and animals when their habitat overlap. The risk of transmission is most likely highest for enteric bacteria as they are shed in high concentration in excrements and are easily picked up by flies. ‘Filth flies’ can ‘bio-enhance’ the transmission of AMR as bacteria multiply in the digestive tract, mouthparts and regurgitation spots.",0.72735995054245,0.6071428571428571,0.7792207792207793,True,False,True,True
How can studying sewage help track antibiotic resistance around the world?,We propose metagenomic analysis of sewage as an ethically acceptable and economically feasible approach for continuous global surveillance and prediction of AMR,"""Antimicrobial Global monitoring of antimicrobial resistance based on metagenomics analyses of urban sewage https://doi.org/10.1038/s41467-019-08853-3 resistance (AMR) is a serious threat to global public health, but obtaining representative data on AMR for healthy human populations is difficult. Here, we use metagenomic analysis of untreated sewage to characterize the bacterial resistome from 79 sites in 60 countries. We find systematic differences in abundance and diversity of AMR genes between Europe/North-America/Oceania and Africa/Asia/South-America.",0.7251157164573669,0.03003003003003003,0.4878048780487805,True,False,False,True
How does a high-concentrate diet affect antimicrobial resistance genes in cattle?,Both the diversity and abundance of these genes were higher in concentrate-fed animals.," genes is directly affected by diet in beef cattle 0378-z ""The emergence and spread of antimicrobial resistance is the most urgent current threat to human and animal health. An improved understanding of the abundance of antimicrobial resistance genes and genes associated with microbial colonisation and pathogenicity in the animal gut will have a major role in reducing the contribution of animal production to this problem.",0.7463590502738953,0.28524590163934427,0.40625,True,False,True,True
Why is 3D bioprinting of bacterial biofilms significant for studying AMR?,The potential to bioprint and study 3D bacterial biofilm constructs could have great clinical significance at a time when antimicrobial resistance is rising to dangerously high levels worldwide.,"al attention."" 3D bioprinting of mature bacterial biofilms for antimicrobial resistance drug testing https://doi.org/10.1088/1758-5090/ab37a0 ""The potential to bioprint and study 3D bacterial biofilm constructs could have great clinical significance at a time when antimicrobial resistance is rising to dangerously high levels worldwide. In this study, clinically relevant bacterial species including Escherichia coli, Staphylococcus aureus (MSSA), Methicillin-resistant Staphylococcus aureus (MRSA) and Pseudomonas aeruginosa were 3D bioprinted using a double-crosslinked alginate bioink to form",0.7668435573577881,0.4911392405063291,0.5977011494252873,True,True,True,True
Are wild animals in cities spreading drug-resistant bacteria?,"Urban wildlife carry a high burden of clinically relevant antimicrobial-resistant E. coli in Nairobi, exhibiting resistance to drugs considered crucial for human medicine by WHO.","re.InterpretationUrban wildlife carry a high burden of clinically relevant antimicrobial-resistant E coli in Nairobi, exhibiting resistance to drugs considered crucial for human medicine by WHO. Identifiable traits of the wildlife contribute to this exposure; however, compared with humans, livestock, and the environment, low phenotypic diversity in wildlife is consistent with the hypothesis that wildlife are a net sink rather than source of clinically relevant resistance.",0.6636593341827393,0.2691131498470948,0.5974025974025974,True,True,True,True
What approach is needed to understand AMR transmission between humans and livestock?,A better understanding of the human-livestock interface will aid in the development of evidence-based and effective One Health interventions that can ultimately reduce the burden of AMR in humans.,"AMR transmission at the human-livestock interface are discussed, with a focus on Escherichia coli.We recapitulate the current understanding of the transmission of AMR between humans and livestock based on current genomic and epidemiological approaches. We discuss how the use of well-designed, high-resolution genome sequencing studies can improve our understanding of the human-livestock interface.A better understanding of the human-livestock interface will aid in the development of evidence-based and effective One Health interventions that can ultimately reduce the burden of AMR in humans.""",0.8107575178146362,0.494949494949495,0.5897435897435898,True,True,True,True
What did the genomic analysis of global sewage samples reveal about resistance gene mobility?,"The genetic environments of 49 common ARGs are highly diverse, with most common ARGs carried by multiple distinct genomic contexts globally and sometimes on plasmids.","""Antimicrobial Global monitoring of antimicrobial resistance based on metagenomics analyses of urban sewage https://doi.org/10.1038/s41467-019-08853-3 resistance (AMR) is a serious threat to global public health, but obtaining representative data on AMR for healthy human populations is difficult. Here, we use metagenomic analysis of untreated sewage to characterize the bacterial resistome from 79 sites in 60 countries. We find systematic differences in abundance and diversity of AMR genes between Europe/North-America/Oceania and Africa/Asia/South-America.",0.6708735227584839,0.43799472295514513,0.5054945054945055,True,False,False,False
Did COVID-19 affect how we monitor and research antibiotic resistance?,"Moreover, antimicrobial resistance (AMR) surveillance and AMS have been deprioritised with diversion of health system resources to the pandemic response.","the potential impacts of the COVID-19 pandemic on antimicrobial resistance research and surveillance https://doi.org/10.1093/trstmh/trab048 ""Antibiotic use in severe acute respiratory syndrome coronavirus 2 (SARS-CoV-2) patients during the COVID-19 pandemic has exceeded the incidence of bacterial coinfections and secondary infections, suggesting inappropriate and excessive prescribing. Even in settings with established antimicrobial stewardship (AMS) programmes, there were weaknesses exposed regarding appropriate antibiotic use in the context of the pandemic.",0.672417938709259,0.5425531914893617,0.5882352941176471,True,False,True,True
How does biofilm thickness influence antibiotic resistance in E. coli biofilms?,Thicker 3D E. coli biofilms had greater resistance to tetracycline than thinner constructs over 7 d of treatment.," coli biofilms had greater resistance to tetracycline than thinner constructs over 7 d of treatment. Our methodology allowed for the precise 3D bioprinting of self-supporting 3D bacterial biofilm structures that developed biofilms during extended culture. 3D biofilm constructs containing bacterial biofilms produce a model with much greater clinical relevance compared to 2D culture models and we have demonstrated their use in antimicrobial testing."" Key considerations on the potential impacts of the COVID-19 pandemic on antimicrobial resistance research and surveillance",0.6594194769859314,0.3380726698262243,0.4675324675324675,True,True,True,True
What advantage does long-read sequencing provide in AMR studies of complex microbial communities?,"The long-read assembly also identifies 94 antimicrobial resistance genes, compared to only seven alleles in the short-read assembly","approaches has been enhanced by recent improvements in short-read sequencing efficiency and assembly algorithms. We describe the results of adding long-read sequencing to the mix of technologies used to assemble a highly complex cattle rumen microbial community, and compare the assembly to current short read-based methods applied to the same sample. Contigs in the long-read assembly were 7-fold longer on average, and contained 7-fold more complete open reading frames (ORF), than the short read assembly, despite having three-fold lower sequence depth.",0.6614662408828735,0.3589041095890411,0.41558441558441556,True,False,True,True
How common was antibiotic resistance in healthy people in South Africa in the 1990s?,"The overall carriage rate of resistance varied from 88.6% for ampicillin, 74.2% for trimethoprim, 52.6% for chloramphenicol, 10.2% for nalidixic acid to 7.5% for gentamicin","50268800056922 ""Summary Between January and March 1992, 361 faecal specimens were collected from the healthy black population in the Transvaal Province of South Africa. Each specimen was examined for the prevalence of antimicrobial resistance in commensal bacteria. Volunteers, from both rural and urban dwellings, were divided into four age groups. The overall carriage rate of resistance varied from 88.6% for ampicillin, 74.2% for trimethoprim, 52.6% for chloramphenicol, 10.2% for nalidixic acid to 7.5% for gentamicin.",0.7565143704414368,0.34532374100719426,0.5,True,True,True,True
What was the main concern regarding antimicrobial resistance in healthy dogs in this study?,"However a high prevalence of MR- and MDR-CONS were found in these dogs, even though they had no prior antimicrobial treatment or admission to veterinary premises. These findings are of concern due to the potential for opportunistic infections, zoonotic transmission and transmission of antimicrobial resistant determinants from these bacteria to coagulase positive staphylococci.","onitoring and evaluation (38 [20]) efforts were lower.International efforts to control antimicrobial resistance varied considerably between countries. Monitoring and evaluation efforts need improving for continuous understanding of national and international progress. International response might not be commensurate with the scale and severity of antimicrobial resistance.None."" Antimicrobial resistance and characterisation of staphylococci isolated from healthy Labrador retrievers in the United Kingdom https://doi.org/10.1186/1746-6148-10-17 ""Coagulase-positive (CoPS) and coagulase-negative",0.5920565128326416,0.7533539731682146,0.7747747747747746,True,False,True,True
Do vaccines cover the types of pneumococcal bacteria that are resistant to antibiotics?,Both vaccines accounted for 98% of penicillin non-susceptible and 100% of erythromycin non-susceptible isolates.," included in the 23 and 14-valent polysaccharide vaccines accounted for 96% and 88% of all isolates. Both vaccines accounted for 98% of penicillin non-susceptible and 100% of erythromycin non-susceptible isolates. The 7, 9, and 11-valent conjugate vaccines covered 61, 68 and 80% of invasive isolates respectively. The coverage of these vaccines was substantially higher in youngest age group with 84, 86 and 93% of invasive isolates in children < 2 years included in the 7, 9 and 11-valent conjugate vaccines compared with 58, 64 and 77% in adults > or = 65 years of age.",0.5780727863311768,0.32748538011695905,0.33802816901408456,True,True,True,True
What unexpected role does the AcrD efflux pump play in Salmonella beyond antibiotic resistance?,"The results of these diverse experiments provide strong evidence that the AcrD efflux pump is not simply a redundant system providing response resilience, but also has distinct physiological functions.","he AcrD efflux pump significantly impacts the physiology of Salmonella enterica serovar Typhimurium. Inactivation of acrD led to changes in the expression of 403 genes involved in fundamental processes, including basic metabolism, virulence, and stress responses. Pathways such as these allow Salmonella to grow, survive in the environment, and cause disease. Indeed, our data show that the acrD mutant is more fit than wild-type Salmonella under standard lab conditions.",0.772291362285614,0.3979848866498741,0.5894736842105264,True,False,False,False
How is hospital wastewater connected to patterns of antimicrobial resistance?,We found that the relationship between hospital wastewater ARGs and antimicrobial usage or clinical isolate resistance varies by specific antimicrobial and bacterial family studied.," and bacterial family https://doi.org/10.1101/19006858 ""ABSTRACT Background Hospital wastewater is a major source of antimicrobial resistance (AMR) outflow into the environment. This study uses metagenomics to study how hospital clinical activity impacts antimicrobial resistance genes (ARGs) abundances in hospital wastewater. Methods Sewage was collected over a 24-hour period from multiple wastewater collection points representing different specialties within a tertiary hospital site and simultaneously from community sewage works.",0.7569161653518677,0.5201149425287356,0.5499999999999999,True,False,True,True
How are machine learning methods being used to tackle antimicrobial resistance?,This is followed by a discussion of challenges and limitations that are considered barriers to scaling up the use of machine learning to address AMR,"ics use and prescription are poorly managed, is considered one of the main reasons for this problem. It is projected that the COVID-19 pandemic will accelerate the threat of AMR due to the increasing use of antibiotics across the world, and especially in countries with limited resources. In recent years, machine learning-based methods showed promising results and proved capable of providing the necessary tools to inform antimicrobial prescription and combat AMR. This timely paper provides a critical and technical review of existing machine learning-based methods for addressing AMR.",0.6911693811416626,0.36486486486486486,0.5227272727272727,True,True,True,True
What did the governance analysis reveal about antimicrobial resistance action plans worldwide?,International efforts to control antimicrobial resistance varied considerably between countries,"ial resistance, 2020–21: a systematic governance analysis of 114 countries"" 3099(22)00796-4 overcome antimicrobial resistance at the national, regional, and global levels is required to evaluate current progress and direct future planning. National action plans (NAPs) are the primary mechanism for guiding national strategy and action for antimicrobial resistance governance. Although several NAPs have been developed, no comprehensive content analysis of these plans exists.",0.7670790553092957,0.2745664739884393,0.3,True,False,True,True
What antimicrobial resistance patterns were observed in pneumococcal bacteria in Scotland between 1988 and 1999?,Both vaccines accounted for 98% of penicillin non-susceptible and 100% of erythromycin non-susceptible isolates.,"on of antimicrobial resistant determinants from these bacteria to coagulase positive staphylococci."" Serotypes/groups distribution and antimicrobial resistance of invasive pneumococcal isolates: implications for vaccine strategies https://doi.org/10.1017/s0950268800004787 ""Based on the invasive pneumococcal isolates referred to reference laboratories in Scotland in 1988-99, we identified the distribution of serotypes/groups and their antimicrobial resistance patterns in order to evaluate the coverage of polysaccharide and the new pneumococcal conjugate vaccines.",0.7381564378738403,0.04580152671755725,0.13114754098360654,False,False,False,False
How did E. coli resistance differ across Zambian dairy farms?,"The estimated prevalence of resistance across the different farming systems was: tetracycline (10.61; 95%CI: 7.40-13.82), ampicillin (6.02; 95%CI: 3.31-8.73), sulfamethoxazole/ trimethoprim (4.49; 95%CI: 2.42-6.56), cefpodoxime (1.91; 95%CI: 0.46-3.36), gentamicin (0.89; 95%CI: 0.06-1.84) and ciprofloxacin (0%)","of antibiotics on small, medium and commercial-sized dairy farms in the central region of Zambia and its relationship to antibiotic resistance in Escherichia coli . A stratified random sample of 104 farms was studied, representing approximately 20% of all dairy farms in the region. On each farm, faecal samples were collected from a random sample of animals and a standardised questionnaire on the usage of antibiotics was completed. An E. coli isolate was obtained from 98.67% (371/376) of the sampled animals and tested for resistance to six classes of antibiotics.",0.7836503982543945,0.8457300275482094,0.676056338028169,True,False,False,False
What did the study of veterinarians in Assam reveal about their antibiotic prescribing habits?,and a need to disseminate clear prescribing guidelines on prudent AMU.,"narians' antibiotic prescribing behaviors and their understanding of antimicrobial resistance (AMR). The study used a telephone survey of 50 veterinarians conducted in five districts in Assam state, India. The survey sought information on the most prevalent animal diseases, veterinarians' awareness of potential preventive measures, including factors determining antimicrobial prescribing; the types of antimicrobials used for different health conditions in different species, and possible options to reduce antimicrobial use (AMU).",0.7327480316162109,0.04975124378109453,0.2564102564102564,True,False,True,True
What were the key findings regarding antimicrobial resistance in primary care settings in Pakistan?,"Antibiotics are gradually becoming less effective against bacteria worldwide, and this issue is of particular concern in economically-developing nations like Pakistan.","d the challenges associated with antimicrobial resistance in primary care (PC) settings in Pakistan. Furthermore, this review aims to identify potential solutions to promote appropriate use of antimicrobials in Pakistan. Following the Preferred Reporting Items for Systematic Reviews and Meta-Analyses extension for scoping reviews (PRISMA-ScR) checklist, a comprehensive scoping review was conducted to review the literature of antimicrobials used, prescribed and dispensed in PC settings in Pakistan. Google Scholar and Pub-Med were searched for the period 2000-2023.",0.7847387790679932,0.48265895953757226,0.547945205479452,True,False,True,True
What role do host epigenetic changes play in antimicrobial resistance?,"Since the discovery of antibiotics, humans have been benefiting from them by decreasing the morbidity and mortality associated with bacterial infections. However, in the past few decades, misuse of antibiotics has led to the emergence of bacterial infections resistant to multiple drugs, a significant health concern."," the bacterial genome and host epigenetic reprogramming due to interaction with resistant pathogens. Epigenetic changes, such as the DNA-methylation-based regulation of bacterial mutation rates or bacteria-induced histone modification in human epithelial cells, facilitate its long-term survival. In this review article, epigenetic changes leading to the development of antibiotic resistance in clinically relevant bacteria are discussed. Additionally, recent lines of evidence focusing on human host epigenetic changes due to the human-pathogen interactions are presented.",0.7710997462272644,0.7592814371257485,0.7835051546391754,True,False,True,True
How does the AcrD efflux pump affect Salmonella fitness and behavior beyond antibiotic resistance?,The acrD mutant outcompeted the wild type in fitness experiments.,"he AcrD efflux pump significantly impacts the physiology of Salmonella enterica serovar Typhimurium. Inactivation of acrD led to changes in the expression of 403 genes involved in fundamental processes, including basic metabolism, virulence, and stress responses. Pathways such as these allow Salmonella to grow, survive in the environment, and cause disease. Indeed, our data show that the acrD mutant is more fit than wild-type Salmonella under standard lab conditions.",0.8327268958091736,0.10638297872340426,0.2368421052631579,True,False,False,False
What did metagenomic analysis of sewage reveal about links between ARG abundance and socioeconomic factors?,"However, AMR gene abundance strongly correlates with socio-economic, health and environmental factors, which we use to predict AMR gene abundances in all countries in the world"," the most important variables and the observed ARG abundance across the different country subgroups. We compared our predictions with available clinical phenotypic data from the SENTRY Antimicrobial Surveillance Program from eight antimicrobial classes and 12 genera from 56 countries.Using antimicrobial use data from between Jan 1, 2016, and Dec 31, 2019, we found that antimicrobial usage was not significantly associated with the global ARG abundance in sewage (p=0·72; incidence rate ratio 1·02 [95% CI 0·92-1·13]), whereas country-specific World Bank's variables explained a large amount of",0.6697499752044678,0.0584958217270195,0.39999999999999997,True,False,False,False
Which specific factors in hospitals influenced the abundance of resistance genes in wastewater?,"Overall, ARG abundance within hospital wastewater did not reflect resistance patterns in clinical isolates from concurrent hospital inpatients.","olated colonies were exposed to antibiotics (sulfamonomethoxine and erythromycin) for several weeks. By comparing them to untreated control group microorganisms, the identification of antibiotic resistance genes (ABRGs), along with their variations in prevalence and abundance, aims to analyse the impact of these two antibiotics on these species."" Secrets of the hospital underbelly: patterns of abundance of antimicrobial resistance genes in hospital wastewater vary by specific antimicrobial and bacterial family https://doi.org/10.1101/19006858 ""ABSTRACT Background Hospital wastewater is a",0.7326775789260864,0.41751824817518246,0.430379746835443,True,False,False,True
How can machine learning help fight antibiotic resistance in low-income countries?,"This is followed by a discussion of challenges and limitations that are considered barriers tCOVID-19 has illustrated the vulnerability of our healthcare systems in co-managing multiple infectious disease threats as resources for monitoring and detecting, and conducting research on antimicrobial resistance have been compromised during the pandemic.o scaling up the use of machine learning to address AMR.","ow and guide environmental policy on AMR."" Antimicrobial Resistance and Machine Learning: Challenges and Opportunities https://doi.org/10.1109/access.2022.3160213 ""Antimicrobial Resistance (AMR) has been identified by the World Health Organisation (WHO) as one of the top ten global health threats. Inappropriate use of antibiotics around the world and in particular in Low-to-Middle-Income Countries (LMICs), where antibiotics use and prescription are poorly managed, is considered one of the main reasons for this problem.",0.669540524482727,0.1683366733466934,0.4655172413793104,True,False,False,True
