query,answer,top_chunk,top_score,similarity_score,f1_score,found_in_top_k,found_in_top_1,found_in_top_3,found_in_top_5
What has COVID-19 taught us about the management of antimicrobial resistance?,"COVID-19 has illustrated the vulnerability of our healthcare systems in co-managing multiple infectious disease threats as resources for monitoring and detecting, and conducting research on antimicrobial resistance have been compromised during the pandemic.","s a global societal priority - even in the face of the worldwide challenge of the COVID-19 pandemic. COVID-19 has illustrated the vulnerability of our healthcare systems in co-managing multiple infectious disease threats as resources for monitoring and detecting, and conducting research on antimicrobial resistance have been compromised during the pandemic. The increased awareness of the importance of infectious diseases, clinical microbiology and infection control and lessons learnt during the COVID-19 pandemic should be exploited to ensure that emergence of future infectious disease threats,",0.6786510944366455,0.5537383177570093,0.673913043478261,True,True,True,True
What is the focus of proposed host-directed therapies for AMR?,"The paper presents the considerable successes that have been achieved over a short period of time in a livestock sector, while generating notes of caution concerning the audit-led management of livestock-related AMR threats.",erapy. We highlight pre-clinical and clinical data pointing towards potential targets and therapies. We suggest that developing focused host-directed therapeutic strategies to enhance 'pauci- inflammatory' microbial killing in myeloid phagocytes that maximizes pathogen clearance while minimizing the harmful consequences of the inflammatory response merits particular attention. We also suggest the importance of One Health approaches in developing host-based approaches though model development and comparative medicine in informing our understanding of how to deliver this strategy.while,0.6574779152870178,0.039119804400977995,0.16901408450704225,False,False,False,False
How common are drug-resistant E. coli in urinary tract infections in rural India?,Results A total of 301 (59.7%) samples showed significant bacteriuria along with symptoms of UTI and among them 103 isolates were identified as E. coli of multiple STs..,"are in Assam, India"" https://doi.org/10.1093/jacamr/dlab164 ""Abstract Objectives We investigated the prevalence and diversity of antimicrobial resistance in bacteria isolated from urine samples of community-onset urinary tract infection (UTI) patients in southern Assam, India. Methods Freshly voided midstream urine samples were collected from patients attending primary healthcare centres, with the patients’ epidemiological data also recorded. Species identification was confirmed using a VITEK 2 compact automated system.",0.6097731590270996,0.4394736842105263,0.5376344086021505,True,False,False,False
What genetic element is responsible for multidrug resistance in the 2287 clone of R. equi?,"Most MDR isolates carried the rpoBS531F mutation of the 2287 clone, while different rpoB mutations (S531L, S531Y) detected in two cases suggest the emergence of novel MDR R. equi strains.","128/jcm.01149-21 ""Clonal multidrug resistance recently emerged in Rhodococcus equi, complicating the therapeutic management of this difficult-to-treat animal- and human- pathogenic actinomycete. The currently spreading multidrug-resistant (MDR) """"2287"""" clone arose in equine farms upon acquisition, and coselection by mass macrolide- rifampin therapy, of the pRErm46 plasmid carrying the erm(46) macrolide-lincosamide- streptogramin resistance determinant, and of an rpoBS531F mutation. Here, we screened a collection of susceptible and macrolide-resistant R.",0.699690580368042,0.4487678339818418,0.5274725274725275,True,False,True,True
What kind of regulation is recommended to improve antibiotic use in poorer countries?,"However, there is limited evidence on the effectiveness of these national efforts in LMICs.","implemented new policies to optimize antibiotic use in both formal and informal healthcare settings. However, there is limited evidence on the effectiveness of these national efforts.Methods: We investigated the empirical relationship between national policies aimed at restricting antibiotic use and actual antibiotic consumption in 138 LMICs. Data on national policies were obtained from the Tripartite AMR Country Self-Assessment Survey (TrACSS) as well as from the Global Survey of Experts on AMR (GSEAR). Seven independent variables pertaining to AMR policies were evaluated.",0.6797302961349487,0.29276315789473684,0.3835616438356164,True,True,True,True
What is a major human factor influencing antibiotic use in animal farming?,The study fills a conspicuous gap in the existing AMR and One Health literatures examining links between farm management practices and AMU and AMR in European livestock production.,"ons in humans and reduce the impact of interventions that curtail antibiotic consumption in animals. More data on the types and dynamics of resistance in the environment and frequency of human-environment transmission is crucial to understanding the population dynamics of antibiotic resistance."" Global trends in antimicrobial resistance on organic and conventional farms ""ABSTRACT Various https://doi.org/10.1101/2023.04.07.536071 stewardship policies, regulations, and voluntary bans have focused on protecting antimicrobials by limiting their use in livestock.",0.7023155093193054,0.03625377643504532,0.23684210526315788,False,False,False,False
What factors were found to be stronger predictors of antimicrobial resistance gene abundance than antibiotic use?,"However, AMR gene abundance strongly correlates with socio-economic, health and environmental factors, which we use to predict AMR gene abundances in all countries in the world.","community influent. ARG and microbiota compositions were correlated (Procrustes analysis, P =0.014). Total antimicrobial usage was not associated with higher ARG abundance in wastewater. However, there was a small positive association between resistance genes and antimicrobial usage matched to ARG phenotype (IRR 1.11, CI 1.06 - 1.16, P &lt;0.001). Furthermore, analysing carbapenem and vancomycin resistance separately indicated that counts of ARGs to these antimicrobials were positively associated with their increased usage (carbapenem rate ratio (RR) 1.91, 95% confidence intervals (CI) 1.01 –",0.6548652648925781,0.0584144645340751,0.4235294117647059,True,False,False,True
Why is antibiotic resistance in animals an ethical and ecological issue?,"Despite a large and rapidly growing volume of research activity and output, primarily on the biological bases of antimicrobial resistance (AMR), epidemiological understanding of the causal mechanisms at play behind the apparent recent global rise in prevalence of AMR has, arguably, progressed very little.","ons in humans and reduce the impact of interventions that curtail antibiotic consumption in animals. More data on the types and dynamics of resistance in the environment and frequency of human-environment transmission is crucial to understanding the population dynamics of antibiotic resistance."" Global trends in antimicrobial resistance on organic and conventional farms ""ABSTRACT Various https://doi.org/10.1101/2023.04.07.536071 stewardship policies, regulations, and voluntary bans have focused on protecting antimicrobials by limiting their use in livestock.",0.6550799608230591,0.11529933481152993,0.39560439560439553,False,False,False,False
What is the advantage of using Hi-C metagenomics in AMR surveillance?,Here we present a laboratory and bioinformatics pipeline HAM-ART (Hi-C Assisted Metagenomics for Antimicrobial Resistance Tracking) optimised forWe propose metagenomic analysis of sewage as an ethically acceptable and economically feasible approach for continuous global surveillance and prediction of AMR.,"omics is a powerful tool to identify antimicrobial resistance (AMR) genes in microbiomes but has the limitation that extrachromosomal DNA, such as plasmids, cannot be linked with the host bacterial chromosome. Here we present a comprehensive laboratory and bioinformatics pipeline HAM-ART (Hi-C Assisted Metagenomics for Antimicrobial Resistance Tracking) optimised for the generation of metagenome-assembled genomes including both chromosomal and extrachromosomal AMR genes.",0.6825915575027466,0.36228287841191065,0.43298969072164945,True,True,True,True
How can studying sewage help track antibiotic resistance around the world?,We propose metagenomic analysis of sewage as an ethically acceptable and economically feasible approach for continuous global surveillance and prediction of AMR.,"""Antimicrobial Global monitoring of antimicrobial resistance based on metagenomics analyses of urban sewage https://doi.org/10.1038/s41467-019-08853-3 resistance (AMR) is a serious threat to global public health, but obtaining representative data on AMR for healthy human populations is difficult. Here, we use metagenomic analysis of untreated sewage to characterize the bacterial resistome from 79 sites in 60 countries. We find systematic differences in abundance and diversity of AMR genes between Europe/North-America/Oceania and Africa/Asia/South-America.",0.7250635027885437,0.03298350824587706,0.4878048780487805,True,False,False,True
How is Uganda trying to monitor antibiotic resistance?,This article examines efforts and progress in developing and implementing a human health antimicrobial resistance surveillance strategy in Uganda.,developing and implementing a human health antimicrobial resistance surveillance strategy in Uganda. We do so within the context of the National Action Plan for tackling antimicrobial resistance (AMR-NAP) launched in 2018. We discuss the technical milestones and progress in implementing surveillance of GLASS priority pathogens under this framework. The preliminary output of the framework examines the performance and compares AMR and AMU surveillance data to explain observed trends.,0.7112874388694763,0.44992295839753466,0.4722222222222222,True,True,True,True
What is a major problem with antibiotic use in Pakistan's primary care?,"Antibiotics are gradually becoming less effective against bacteria worldwide, and this issue is of particular concern in economically-developing nations like Pakistan.","tance in primary care facilities across Pakistan: Current challenges and implications for the future https://doi.org/10.1016/j.jiph.2023.10.046 ""Antibiotics are gradually becoming less effective against bacteria worldwide, and this issue is of particular concern in economically-developing nations like Pakistan. We undertook a scoping review in order to review the literature on antimicrobial use, prescribing, dispensing and the challenges associated with antimicrobial resistance in primary care (PC) settings in Pakistan.",0.7238122224807739,0.48265895953757226,0.547945205479452,True,True,True,True
How do UK farm vets view diagnostic tests in managing antibiotic use?,The findings identify a considerable ambivalence on the part of farm animal veterinarians regarding the current and future uses of rapid and point-of-care diagnostic tests as a means of improving clinical diagnosis and addressing inappropriate antibiotic medicine use., and others are increasingly seeking to make diagnostic tests mandatory before the use of critically important antibiotics. Method This paper reports the findings of a recent large-scale online survey of UK farm animal veterinarians (n=153) which investigated current veterinary diagnostic practice with particular attention to the relationship between diagnostic test use and antibiotic treatment. Results Results revealed a range of factors that influence veterinary diagnostic practice and demonstrate the continuing importance of clinical observation and animal/herd knowledge in the selection,0.7972759008407593,0.6218097447795824,0.6896551724137931,True,False,False,True
How might epigenetic changes contribute to antimicrobial resistance?,"Since the discovery of antibiotics, humans have been benefiting from them by decreasing the morbidity and mortality associated with bacterial infections."," the bacterial genome and host epigenetic reprogramming due to interaction with resistant pathogens. Epigenetic changes, such as the DNA-methylation-based regulation of bacterial mutation rates or bacteria-induced histone modification in human epithelial cells, facilitate its long-term survival. In this review article, epigenetic changes leading to the development of antibiotic resistance in clinically relevant bacteria are discussed. Additionally, recent lines of evidence focusing on human host epigenetic changes due to the human-pathogen interactions are presented.",0.7464088797569275,0.45603576751117736,0.4871794871794871,True,False,True,True
What is the title of the study concerning masuring AMR in untreated sewage?,Global monitoring of antimicrobial resistance based on metagenomics analyses of urban sewagehttps://doi.org/10.1038/s41467-019-08853-3,"""Antimicrobial Global monitoring of antimicrobial resistance based on metagenomics analyses of urban sewage https://doi.org/10.1038/s41467-019-08853-3 resistance (AMR) is a serious threat to global public health, but obtaining representative data on AMR for healthy human populations is difficult. Here, we use metagenomic analysis of untreated sewage to characterize the bacterial resistome from 79 sites in 60 countries. We find systematic differences in abundance and diversity of AMR genes between Europe/North-America/Oceania and Africa/Asia/South-America.",0.6097639799118042,0.3856115107913669,0.2941176470588235,True,True,True,True
